{
  "$ref": "#/definitions/WhaleDetail",
  "$schema": "http://json-schema.org/draft-07/schema#",
  "definitions": {
    "WhaleDetail": {
      "additionalProperties": false,
      "properties": {
        "biography": {
          "type": [
            "string",
            "null"
          ]
        },
        "birthYear": {
          "anyOf": [
            {
              "type": "integer"
            },
            {
              "type": "null"
            }
          ]
        },
        "catalogId": {
          "maxLength": 200,
          "minLength": 1,
          "type": "string"
        },
        "deathYear": {
          "anyOf": [
            {
              "type": "integer"
            },
            {
              "type": "null"
            }
          ]
        },
        "distinguishingMarks": {
          "type": [
            "string",
            "null"
          ]
        },
        "ecotype": {
          "enum": [
            "RESIDENT",
            "BIGGS",
            "OFFSHORE",
            "UNKNOWN"
          ],
          "type": "string"
        },
        "heroImageUrl": {
          "anyOf": [
            {
              "format": "uri",
              "pattern": "^https?:\\/\\/",
              "type": "string"
            },
            {
              "type": "null"
            }
          ]
        },
        "id": {
          "maxLength": 200,
          "minLength": 1,
          "type": "string"
        },
        "mother": {
          "anyOf": [
            {
              "additionalProperties": false,
              "properties": {
                "catalogId": {
                  "maxLength": 200,
                  "minLength": 1,
                  "type": "string"
                },
                "name": {
                  "type": [
                    "string",
                    "null"
                  ]
                }
              },
              "required": [
                "catalogId",
                "name"
              ],
              "type": "object"
            },
            {
              "type": "null"
            }
          ]
        },
        "name": {
          "type": [
            "string",
            "null"
          ]
        },
        "notableEvents": {
          "items": {
            "additionalProperties": false,
            "properties": {
              "date": {
                "type": "string"
              },
              "source": {
                "type": "string"
              },
              "summary": {
                "type": "string"
              },
              "type": {
                "enum": [
                  "birth",
                  "death",
                  "loss",
                  "capture",
                  "release",
                  "pod-switch",
                  "first-documented",
                  "milestone"
                ],
                "type": "string"
              },
              "year": {
                "type": "number"
              }
            },
            "required": [
              "year",
              "type",
              "summary"
            ],
            "type": "object"
          },
          "type": "array"
        },
        "offspring": {
          "items": {
            "additionalProperties": false,
            "properties": {
              "catalogId": {
                "maxLength": 200,
                "minLength": 1,
                "type": "string"
              },
              "name": {
                "type": [
                  "string",
                  "null"
                ]
              }
            },
            "required": [
              "catalogId",
              "name"
            ],
            "type": "object"
          },
          "type": "array"
        },
        "pod": {
          "type": [
            "string",
            "null"
          ]
        },
        "recentSightings": {
          "items": {
            "additionalProperties": false,
            "properties": {
              "id": {
                "maxLength": 200,
                "minLength": 1,
                "type": "string"
              },
              "latitude": {
                "maximum": 90,
                "minimum": -90,
                "type": "number"
              },
              "locationName": {
                "type": [
                  "string",
                  "null"
                ]
              },
              "longitude": {
                "maximum": 180,
                "minimum": -180,
                "type": "number"
              },
              "observedAt": {
                "format": "date-time",
                "type": "string"
              }
            },
            "required": [
              "id",
              "observedAt",
              "locationName",
              "latitude",
              "longitude"
            ],
            "type": "object"
          },
          "type": "array"
        },
        "sex": {
          "enum": [
            "MALE",
            "FEMALE",
            "UNKNOWN"
          ],
          "type": "string"
        },
        "sourceCitations": {
          "items": {
            "additionalProperties": false,
            "properties": {
              "label": {
                "type": "string"
              },
              "url": {
                "format": "uri",
                "pattern": "^https?:\\/\\/",
                "type": "string"
              }
            },
            "required": [
              "label",
              "url"
            ],
            "type": "object"
          },
          "type": "array"
        },
        "status": {
          "enum": [
            "ALIVE",
            "DECEASED",
            "UNKNOWN"
          ],
          "type": "string"
        }
      },
      "required": [
        "id",
        "catalogId",
        "name",
        "ecotype",
        "pod",
        "sex",
        "birthYear",
        "deathYear",
        "status",
        "biography",
        "distinguishingMarks",
        "heroImageUrl",
        "notableEvents",
        "sourceCitations",
        "mother",
        "offspring",
        "recentSightings"
      ],
      "type": "object"
    }
  }
}
